SIRA NO;ENDEKS KODU;ENDEKSLER;ENDEKSLERIN INGILIZCE ISIMLERI;KUR TURU;TARIH;KAPANIS
ORDER;INDEX CODE;INDEX NAMES IN TURKISH;INDICES;CURRENCY TYPE;DATE;CLOSING VALUE
1;XU100_CFNNTLTL;BIST 100 GETIRI;BIST 100 RETURN;TRY;06/01/2023;9773.15
2;XU100_CFNNTLUS;BIST 100 GETIRI (ABD DOLARI);BIST 100 RETURN (USD);USD;06/01/2023;3033.15
3;XU100_CFNNTLER;BIST 100 GETIRI (EURO);BIST 100 RETURN (EURO);EUR;06/01/2023;3382.68
4;XU050_CFNNTLTL;BIST 50 GETIRI;BIST 50 RETURN;TRY;06/01/2023;8591.99
5;XU050_CFNNTLUS;BIST 50 GETIRI (ABD DOLARI);BIST 50 RETURN (USD);USD;06/01/2023;2666.57
6;XU050_CFNNTLER;BIST 50 GETIRI (EURO);BIST 50 RETURN (EURO);EUR;06/01/2023;2973.86
7;XU030_CFNNTLTL;BIST 30 GETIRI;BIST 30 RETURN;TRY;06/01/2023;10581.09
8;XU030_CFNNTLUS;BIST 30 GETIRI (ABD DOLARI);BIST 30 RETURN (USD);USD;06/01/2023;3283.9
9;XU030_CFNNTLER;BIST 30 GETIRI (EURO);BIST 30 RETURN (EURO);EUR;06/01/2023;3662.32
10;XLBNK_CFNNTLTL;BIST LIKIT BANKA GETIRI;BIST LIQUID BANKS RETURN;TRY;06/01/2023;4398.85
11;XLBNK_CFNNTLUS;BIST LIKIT BANKA GETIRI (ABD DOLARI);BIST LIQUID BANKS RETURN (USD);USD;06/01/2023;1365.21
12;XLBNK_CFNNTLER;BIST LIKIT BANKA GETIRI (EURO);BIST LIQUID BANKS RETURN (EURO);EUR;06/01/2023;1522.53
13;X10XB_CFNNTLTL;BIST BANKA DISI LIKIT 10 GETIRI;BIST LIQUID 10 EX BANKS RETURN;TRY;06/01/2023;7917.09
14;X10XB_CFNNTLUS;BIST BANKA DISI LIKIT 10 GETIRI (ABD DOLARI);BIST LIQUID 10 EX BANKS RETURN (USD);USD;06/01/2023;2457.11
15;X10XB_CFNNTLER;BIST BANKA DISI LIKIT 10 GETIRI (EURO);BIST LIQUID 10 EX BANKS RETURN (EURO);EUR;06/01/2023;2740.26
16;XUTUM_CFNNTLTL;BIST TUM GETIRI;BIST ALL SHARES RETURN;TRY;06/01/2023;10779.94
17;XUTUM_CFNNTLUS;BIST TUM GETIRI (ABD DOLARI);BIST ALL SHARES RETURN (USD);USD;06/01/2023;3345.61
18;XUTUM_CFNNTLER;BIST TUM GETIRI (EURO);BIST ALL SHARES RETURN (EURO);EUR;06/01/2023;3731.15
19;XELOT_CFNNTLTL;BIST 50-30 GETIRI;BIST 50-30 RETURN;TRY;06/01/2023;4938.54
20;XELOT_CFNNTLUS;BIST 50-30 GETIRI (ABD DOLARI);BIST 50-30 RETURN (USD);USD;06/01/2023;1532.7
21;XELOT_CFNNTLER;BIST 50-30 GETIRI (EURO);BIST 50-30 RETURN (EURO);EUR;06/01/2023;1709.32
22;XELOS_CFCNTLTL;BIST 50-30 AGIRLIK SINIRLAMALI 10 GETIRI;BIST 50-30 CAPPED 10 RETURN;TRY;06/01/2023;4896.55
23;XELOS_CFCNTLUS;BIST 50-30 AGIRLIK SINIRLAMALI 10 GETIRI (ABD DOLARI);BIST 50-30 CAPPED 10 RETURN (USD);USD;06/01/2023;1519.67
24;XELOS_CFCNTLER;BIST 50-30 AGIRLIK SINIRLAMALI 10 GETIRI (EURO);BIST 50-30 CAPPED 10 RETURN (EURO);EUR;06/01/2023;1694.79
25;XELOC_CFCNTLTL;BIST 50-30 AGIRLIK SINIRLAMALI 25 GETIRI;BIST 50-30 CAPPED 25 RETURN;TRY;06/01/2023;4937.25
26;XELOC_CFCNTLUS;BIST 50-30 AGIRLIK SINIRLAMALI 25 GETIRI (ABD DOLARI);BIST 50-30 CAPPED 25 RETURN (USD);USD;06/01/2023;1532.3
27;XELOC_CFCNTLER;BIST 50-30 AGIRLIK SINIRLAMALI 25 GETIRI (EURO);BIST 50-30 CAPPED 25 RETURN (EURO);EUR;06/01/2023;1708.88
28;XYUZO_CFNNTLTL;BIST 100-30 GETIRI;BIST 100-30 RETURN;TRY;06/01/2023;13444.03
29;XYUZO_CFNNTLUS;BIST 100-30 GETIRI (ABD DOLARI);BIST 100-30 RETURN (USD);USD;06/01/2023;4172.43
30;XYUZO_CFNNTLER;BIST 100-30 GETIRI (EURO);BIST 100-30 RETURN (EURO);EUR;06/01/2023;4653.24
31;XTUMY_CFNNTLTL;BIST TUM-100 GETIRI;BIST ALL SHARES-100 RETURN;TRY;06/01/2023;21154.28
32;XTUMY_CFNNTLUS;BIST TUM-100 GETIRI (ABD DOLARI);BIST ALL SHARES-100 RETURN (USD);USD;06/01/2023;6565.34
33;XTUMY_CFNNTLER;BIST TUM-100 GETIRI (EURO);BIST ALL SHARES-100 RETURN (EURO);EUR;06/01/2023;7321.91
34;X100S_CFCNTLTL;BIST 100 AGIRLIK SINIRLAMALI 10 GETIRI;BIST 100 CAPPED 10 RETURN;TRY;06/01/2023;6838.48
35;X100S_CFCNTLER;BIST 100 AGIRLIK SINIRLAMALI 10 GETIRI (EURO);BIST 100 CAPPED 10 RETURN (EURO);EUR;06/01/2023;2366.93
36;X100S_CFCNTLUS;BIST 100 AGIRLIK SINIRLAMALI 10 GETIRI (ABD DOLARI);BIST 100 CAPPED 10 RETURN (USD);USD;06/01/2023;2122.36
37;X100C_CFCNTLTL;BIST 100 AGIRLIK SINIRLAMALI 25 GETIRI;BIST 100 CAPPED 25 RETURN;TRY;06/01/2023;5745.68
38;X100C_CFCNTLUS;BIST 100 AGIRLIK SINIRLAMALI 25 GETIRI (ABD DOLARI);BIST 100 CAPPED 25 RETURN (USD);USD;06/01/2023;1783.2
39;X100C_CFCNTLER;BIST 100 AGIRLIK SINIRLAMALI 25 GETIRI (EURO);BIST 100 CAPPED 25 RETURN (EURO);EUR;06/01/2023;1988.69
40;X030S_CFCNTLTL;BIST 30 AGIRLIK SINIRLAMALI 10 GETIRI;BIST 30 CAPPED 10 RETURN;TRY;06/01/2023;7635.35
41;X030S_CFCNTLUS;BIST 30 AGIRLIK SINIRLAMALI 10 GETIRI (ABD DOLARI);BIST 30 CAPPED 10 RETURN (USD);USD;06/01/2023;2369.67
42;X030S_CFCNTLER;BIST 30 AGIRLIK SINIRLAMALI 10 GETIRI (EURO);BIST 30 CAPPED 10 RETURN (EURO);EUR;06/01/2023;2642.74
43;X030C_CFCNTLTL;BIST 30 AGIRLIK SINIRLAMALI 25 GETIRI;BIST 30 CAPPED 25 RETURN;TRY;06/01/2023;6276.09
44;X030C_CFCNTLUS;BIST 30 AGIRLIK SINIRLAMALI 25 GETIRI (ABD DOLARI);BIST 30 CAPPED 25 RETURN (USD);USD;06/01/2023;1947.82
45;X030C_CFCNTLER;BIST 30 AGIRLIK SINIRLAMALI 25 GETIRI (EURO);BIST 30 CAPPED 25 RETURN (EURO);EUR;06/01/2023;2172.28
46;X030EA;BIST 30 ESIT AGIRLIKLI GETIRI;BIST 30 EQUAL WEIGHTED RETURN;TRY;06/01/2023;12640.67
47;X030EA_CFENTLUS;BIST 30 ESIT AGIRLIKLI GETIRI (ABD DOLARI);BIST 30 EQUAL WEIGHTED RETURN (USD);USD;06/01/2023;3923.1
48;X030EA_CFENTLER;BIST 30 ESIT AGIRLIKLI GETIRI (EURO);BIST 30 EQUAL WEIGHTED RETURN (EURO);EUR;06/01/2023;4375.18
49;XK030EA;BIST KATILIM 30 ESIT AGIRLIKLI GETIRI;BIST PARTICIPATION 30 EQUAL WEIGHTED RETURN;TRY;06/01/2023;4964
50;XK030EA_CFENTLUS;BIST KATILIM 30 ESIT AGIRLIKLI GETIRI (ABD DOLARI);BIST PARTICIPATION 30 EQUAL WEIGHTED RETURN (USD);USD;06/01/2023;1540.6
51;XK030EA_CFENTLER;BIST KATILIM 30 ESIT AGIRLIKLI GETIRI (EURO);BIST PARTICIPATION 30 EQUAL WEIGHTED RETURN (EURO);EUR;06/01/2023;1718.14
52;XYLDZ_CFNNTLTL;BIST YILDIZ GETIRI;BIST STARS RETURN;TRY;06/01/2023;6827.29
53;XYLDZ_CFNNTLUS;BIST YILDIZ  GETIRI (ABD DOLARI);BIST STARS RETURN (USD);USD;06/01/2023;2118.88
54;XYLDZ_CFNNTLER;BIST YILDIZ  GETIRI (EURO);BIST STARS RETURN (EURO);EUR;06/01/2023;2363.06
55;XBANA_CFNNTLTL;BIST ANA GETIRI;BIST MAIN RETURN;TRY;06/01/2023;16000.68
56;XBANA_CFNNTLUS;BIST ANA GETIRI (ABD DOLARI);BIST MAIN RETURN (USD);USD;06/01/2023;4965.9
57;XBANA_CFNNTLER;BIST ANA GETIRI (EURO);BIST MAIN RETURN (EURO);EUR;06/01/2023;5538.15
58;XHARZ_CFCNTLTL;BIST HALKA ARZ GETIRI;BIST IPO RETURN;TRY;06/01/2023;55557.09
59;XHARZ_CFCNTLUS;BIST HALKA ARZ GETIRI (ABD DOLARI);BIST IPO RETURN (USD);USD;06/01/2023;17242.44
60;XHARZ_CFCNTLER;BIST HALKA ARZ GETIRI (EURO);BIST IPO RETURN (EURO);EUR;06/01/2023;19229.39
61;XKOBI_CFNNTLTL;BIST KOBI SANAYI GETIRI;BIST SME INDUSTRIAL RETURN;TRY;06/01/2023;10522.75
62;XKOBI_CFNNTLUS;BIST KOBI SANAYI GETIRI (ABD DOLARI);BIST SME INDUSTRIAL RETURN (USD);USD;06/01/2023;3265.79
63;XKOBI_CFNNTLER;BIST KOBI SANAYI GETIRI (EURO);BIST SME INDUSTRIAL RETURN (EURO);EUR;06/01/2023;3642.13
64;XTMTU_CFNNTLTL;BIST TEMETTU GETIRI;BIST DIVIDEND RETURN;TRY;06/01/2023;7349.1
65;XTMTU_CFNNTLER;BIST TEMETTU GETIRI (EURO);BIST DIVIDEND RETURN (EURO);EUR;06/01/2023;2543.67
66;XTMTU_CFNNTLUS;BIST TEMETTU GETIRI (ABD DOLARI);BIST DIVIDEND RETURN (USD);USD;06/01/2023;2280.83
67;XTM25_CFNNTLTL;BIST TEMETTU 25 GETIRI;BIST DIVIDEND 25 RETURN;TRY;06/01/2023;10524.83
68;XTM25_CFNNTLUS;BIST TEMETTU 25 GETIRI (ABD DOLARI);BIST DIVIDEND 25 RETURN (USD);USD;06/01/2023;3266.44
69;XTM25_CFNNTLER;BIST TEMETTU 25 GETIRI (EURO);BIST DIVIDEND 25 RETURN (EURO);EUR;06/01/2023;3642.85
70;XKTUM_CFNNTLTL;BIST KATILIM TUM GETIRI;BIST PARTICIPATION ALL SHARES RETURN;TRY;06/01/2023;5280.37
71;XKTUM_CFNNTLUS;BIST KATILIM TUM GETIRI (ABD DOLARI);BIST PARTICIPATION ALL SHARES RETURN (USD);USD;06/01/2023;1638.79
72;XKTUM_CFNNTLER;BIST KATILIM TUM GETIRI (EURO);BIST PARTICIPATION ALL SHARES RETURN (EURO);EUR;06/01/2023;1827.64
73;XK100_CFCNTLTL;BIST KATILIM 100 GETIRI;BIST PARTICIPATION 100 RETURN;TRY;06/01/2023;5394.58
74;XK100_CFCNTLUS;BIST KATILIM 100 GETIRI (ABD DOLARI);BIST PARTICIPATION 100 RETURN (USD);USD;06/01/2023;1674.24
75;XK100_CFCNTLER;BIST KATILIM 100 GETIRI (EURO);BIST PARTICIPATION 100 RETURN (EURO);EUR;06/01/2023;1867.17
76;XK050_CFCNTLTL;BIST KATILIM 50 GETIRI;BIST PARTICIPATION 50 RETURN;TRY;06/01/2023;5757.21
77;XK050_CFCNTLUS;BIST KATILIM 50 GETIRI (ABD DOLARI);BIST PARTICIPATION 50 RETURN (USD);USD;06/01/2023;1786.78
78;XK050_CFCNTLER;BIST KATILIM 50 GETIRI (EURO);BIST PARTICIPATION 50 RETURN (EURO);EUR;06/01/2023;1992.68
79;XK030_CFCNTLTL;BIST KATILIM 30 GETIRI;BIST PARTICIPATION 30 RETURN;TRY;06/01/2023;5840.71
80;XK030_CFCNTLUS;BIST KATILIM 30 GETIRI (ABD DOLARI);BIST PARTICIPATION 30 RETURN (USD);USD;06/01/2023;1812.7
81;XK030_CFCNTLER;BIST KATILIM 30 GETIRI (EURO);BIST PARTICIPATION 30 RETURN (EURO);EUR;06/01/2023;2021.58
82;XSRDK_CFCNTLTL;BIST KATILIM SURDURULEBILIRLIK GETIRI;BIST PARTICIPATION SUSTAINABILITY RETURN;TRY;06/01/2023;5812.08
83;XSRDK_CFCNTLUS;BIST KATILIM SURDURULEBILIRLIK GETIRI (ABD DOLARI);BIST PARTICIPATION SUSTAINABILITY RETURN (USD);USD;06/01/2023;1803.81
84;XSRDK_CFCNTLER;BIST KATILIM SURDURULEBILIRLIK GETIRI (EURO);BIST PARTICIPATION SUSTAINABILITY RETURN (EURO);EUR;06/01/2023;2011.68
85;XKTMT_CFCNTLTL;BIST KATILIM TEMETTU GETIRI;BIST PARTICIPATION DIVIDEND RETURN;TRY;06/01/2023;5610.01
86;XKTMT_CFCNTLUS;BIST KATILIM TEMETTU GETIRI (ABD DOLARI);BIST PARTICIPATION DIVIDEND RETURN (USD);USD;06/01/2023;1741.1
87;XKTMT_CFCNTLER;BIST KATILIM TEMETTU GETIRI (EURO);BIST PARTICIPATION DIVIDEND RETURN (EURO);EUR;06/01/2023;1941.73
88;XKURY_CFNNTLTL;BIST KURUMSAL YONETIM GETIRI;BIST CORPORATE GOVERNANCE RETURN;TRY;06/01/2023;7627.15
89;XKURY_CFNNTLUS;BIST KURUMSAL YONETIM GETIRI (ABD DOLARI);BIST CORPORATE GOVERNANCE RETURN (USD);USD;06/01/2023;2367.13
90;XKURY_CFNNTLER;BIST KURUMSAL YONETIM GETIRI (EURO);BIST CORPORATE GOVERNANCE RETURN (EURO);EUR;06/01/2023;2639.91
91;XUSRD_CFCNTLTL;BIST SURDURULEBILIRLIK GETIRI;BIST SUSTAINABILITY RETURN;TRY;06/01/2023;8020.64
92;XUSRD_CFCNTLUS;BIST SURDURULEBILIRLIK GETIRI (ABD DOLARI);BIST SUSTAINABILITY RETURN (USD);USD;06/01/2023;2489.25
93;XUSRD_CFCNTLER;BIST SURDURULEBILIRLIK GETIRI (EURO);BIST SUSTAINABILITY RETURN (EURO);EUR;06/01/2023;2776.1
94;XSD25_CFCNTLTL;BIST SURDURULEBILIRLIK 25 GETIRI;BIST SUSTAINABILITY 25 RETURN;TRY;06/01/2023;6337.87
95;XSD25_CFCNTLUS;BIST SURDURULEBILIRLIK 25 GETIRI (ABD DOLARI);BIST SUSTAINABILITY 25 RETURN (USD);USD;06/01/2023;1966.99
96;XSD25_CFCNTLER;BIST SURDURULEBILIRLIK 25 GETIRI (EURO);BIST SUSTAINABILITY 25 RETURN (EURO);EUR;06/01/2023;2193.66
97;XUSIN_CFNNTLTL;BIST SINAI GETIRI;BIST INDUSTRIALS RETURN;TRY;06/01/2023;20835.55
98;XUSIN_CFNNTLUS;BIST SINAI GETIRI (ABD DOLARI);BIST INDUSTRIALS RETURN (USD);USD;06/01/2023;6466.42
99;XUSIN_CFNNTLER;BIST SINAI GETIRI (EURO);BIST INDUSTRIALS RETURN (EURO);EUR;06/01/2023;7211.59
100;XGIDA_CFNNTLTL;BIST GIDA ICECEK GETIRI;BIST FOOD BEVERAGE RETURN;TRY;06/01/2023;7893.4
101;XGIDA_CFNNTLUS;BIST GIDA ICECEK GETIRI (ABD DOLARI);BIST FOOD BEVERAGE RETURN (USD);USD;06/01/2023;2449.76
102;XGIDA_CFNNTLER;BIST GIDA ICECEK GETIRI (EURO);BIST FOOD BEVERAGE RETURN (EURO);EUR;06/01/2023;2732.06
103;XKMYA_CFNNTLTL;BIST KIMYA PETROL PLASTIK GETIRI;BIST CHEM. PETROL PLASTIC RETURN;TRY;06/01/2023;29062.27
104;XKMYA_CFNNTLUS;BIST KIMYA PETROL PLASTIK GETIRI (ABD DOLARI);BIST CHEM. PETROL PLASTIC RETURN (USD);USD;06/01/2023;9019.63
105;XKMYA_CFNNTLER;BIST KIMYA PETROL PLASTIK GETIRI (EURO);BIST CHEM. PETROL PLASTIC RETURN (EURO);EUR;06/01/2023;10059.02
106;XMADN_CFNNTLTL;BIST MADENCILIK GETIRI;BIST MINING RETURN;TRY;06/01/2023;7772.33
107;XMADN_CFNNTLUS;BIST MADENCILIK GETIRI (ABD DOLARI);BIST MINING RETURN (USD);USD;06/01/2023;2412.18
108;XMADN_CFNNTLER;BIST MADENCILIK GETIRI (EURO);BIST MINING RETURN (EURO);EUR;06/01/2023;2690.15
109;XMANA_CFNNTLTL;BIST METAL ANA GETIRI;BIST BASIC METAL RETURN;TRY;06/01/2023;31977.34
110;XMANA_CFNNTLUS;BIST METAL ANA GETIRI (ABD DOLARI);BIST BASIC METAL RETURN (USD);USD;06/01/2023;9924.34
111;XMANA_CFNNTLER;BIST METAL ANA GETIRI (EURO);BIST BASIC METAL RETURN (EURO);EUR;06/01/2023;11067.98
112;XMESY_CFNNTLTL;BIST METAL ESYA MAKINA GETIRI;BIST METAL PRODUCTS MACH. RETURN;TRY;06/01/2023;27986.21
113;XMESY_CFNNTLER;BIST METAL ESYA MAKINA GETIRI (EURO);BIST METAL PRODUCTS MACH. RETURN (EURO);EUR;06/01/2023;9686.57
114;XMESY_CFNNTLUS;BIST METAL ESYA MAKINA GETIRI (ABD DOLARI);BIST METAL PRODUCTS MACH. RETURN (USD);USD;06/01/2023;8685.67
115;XKAGT_CFNNTLTL;BIST ORMAN KAGIT BASIM GETIRI;BIST WOOD PAPER PRINTING RETURN;TRY;06/01/2023;7476.53
116;XKAGT_CFNNTLUS;BIST ORMAN KAGIT BASIM GETIRI (ABD DOLARI);BIST WOOD PAPER PRINTING RETURN (USD);USD;06/01/2023;2320.38
117;XKAGT_CFNNTLER;BIST ORMAN KAGIT BASIM GETIRI (EURO);BIST WOOD PAPER PRINTING RETURN (EURO);EUR;06/01/2023;2587.77
118;XTAST_CFNNTLTL;BIST TAS TOPRAK GETIRI;BIST NONMETAL MIN. PRODUCT RETURN;TRY;06/01/2023;15706.41
119;XTAST_CFNNTLUS;BIST TAS TOPRAK GETIRI (ABD DOLARI);BIST NONMETAL MIN. PRODUCT RETURN (USD);USD;06/01/2023;4874.57
120;XTAST_CFNNTLER;BIST TAS TOPRAK GETIRI (EURO);BIST NONMETAL MIN. PRODUCT RETURN (EURO);EUR;06/01/2023;5436.29
121;XTEKS_CFNNTLTL;BIST TEKSTIL DERI GETIRI;BIST TEXTILE LEATHER RETURN;TRY;06/01/2023;4582.12
122;XTEKS_CFNNTLUS;BIST TEKSTIL DERI GETIRI (ABD DOLARI);BIST TEXTILE LEATHER RETURN (USD);USD;06/01/2023;1422.09
123;XTEKS_CFNNTLER;BIST TEKSTIL DERI GETIRI (EURO);BIST TEXTILE LEATHER RETURN (EURO);EUR;06/01/2023;1585.96
124;XUHIZ_CFNNTLTL;BIST HIZMETLER GETIRI;BIST SERVICES RETURN;TRY;06/01/2023;7885.29
125;XUHIZ_CFNNTLUS;BIST HIZMETLER GETIRI (ABD DOLARI);BIST SERVICES RETURN (USD);USD;06/01/2023;2447.24
126;XUHIZ_CFNNTLER;BIST HIZMETLER GETIRI (EURO);BIST SERVICES RETURN (EURO);EUR;06/01/2023;2729.25
127;XELKT_CFNNTLTL;BIST ELEKTRIK GETIRI;BIST ELECTRICITY RETURN;TRY;06/01/2023;624.67
128;XELKT_CFNNTLUS;BIST ELEKTRIK GETIRI (ABD DOLARI);BIST ELECTRICITY RETURN (USD);USD;06/01/2023;193.87
129;XELKT_CFNNTLER;BIST ELEKTRIK GETIRI (EURO);BIST ELECTRICITY RETURN (EURO);EUR;06/01/2023;216.21
130;XILTM_CFNNTLTL;BIST ILETISIM GETIRI;BIST TELECOMMUNICATION RETURN;TRY;06/01/2023;2205.35
131;XILTM_CFNNTLUS;BIST ILETISIM GETIRI (ABD DOLARI);BIST TELECOMMUNICATION RETURN (USD);USD;06/01/2023;684.44
132;XILTM_CFNNTLER;BIST ILETISIM GETIRI (EURO);BIST TELECOMMUNICATION RETURN (EURO);EUR;06/01/2023;763.32
133;XINSA_CFNNTLTL;BIST INSAAT GETIRI;BIST CONSTRUCTION RETURN;TRY;06/01/2023;9736.3
134;XINSA_CFNNTLUS;BIST INSAAT GETIRI (ABD DOLARI);BIST CONSTRUCTION RETURN (USD);USD;06/01/2023;3021.71
135;XINSA_CFNNTLER;BIST INSAAT GETIRI (EURO);BIST CONSTRUCTION RETURN (EURO);EUR;06/01/2023;3369.92
136;XSPOR_CFNNTLTL;BIST SPOR GETIRI;BIST SPORTS RETURN;TRY;06/01/2023;2702.24
137;XSPOR_CFNNTLUS;BIST SPOR GETIRI (ABD DOLARI);BIST SPORTS RETURN (USD);USD;06/01/2023;838.65
138;XSPOR_CFNNTLER;BIST SPOR GETIRI (EURO);BIST SPORTS RETURN (EURO);EUR;06/01/2023;935.3
139;XTCRT_CFNNTLTL;BIST TICARET GETIRI;BIST W. AND RETAIL TRADE RETURN;TRY;06/01/2023;12337.06
140;XTCRT_CFNNTLUS;BIST TICARET GETIRI (ABD DOLARI);BIST W. AND RETAIL TRADE RETURN (USD);USD;06/01/2023;3828.87
141;XTCRT_CFNNTLER;BIST TICARET GETIRI (EURO);BIST W. AND RETAIL TRADE RETURN (EURO);EUR;06/01/2023;4270.1
142;XTRZM_CFNNTLTL;BIST TURIZM GETIRI;BIST TOURISM RETURN;TRY;06/01/2023;786.87
143;XTRZM_CFNNTLUS;BIST TURIZM GETIRI (ABD DOLARI);BIST TOURISM RETURN (USD);USD;06/01/2023;244.21
144;XTRZM_CFNNTLER;BIST TURIZM GETIRI (EURO);BIST TOURISM RETURN (EURO);EUR;06/01/2023;272.35
145;XULAS_CFNNTLTL;BIST ULASTIRMA GETIRI;BIST TRANSPORTATION RETURN;TRY;06/01/2023;33065.97
146;XULAS_CFNNTLUS;BIST ULASTIRMA GETIRI (ABD DOLARI);BIST TRANSPORTATION RETURN (USD);USD;06/01/2023;10262.2
147;XULAS_CFNNTLER;BIST ULASTIRMA GETIRI (EURO);BIST TRANSPORTATION RETURN (EURO);EUR;06/01/2023;11444.78
148;XUMAL_CFNNTLTL;BIST MALI GETIRI;BIST FINANCIALS RETURN;TRY;06/01/2023;7982.19
149;XUMAL_CFNNTLUS;BIST MALI GETIRI (ABD DOLARI);BIST FINANCIALS RETURN (USD);USD;06/01/2023;2477.31
150;XUMAL_CFNNTLER;BIST MALI GETIRI (EURO);BIST FINANCIALS RETURN (EURO);EUR;06/01/2023;2762.79
151;XBANK_CFNNTLTL;BIST BANKA GETIRI;BIST BANKS RETURN;TRY;06/01/2023;7373.65
152;XBANK_CFNNTLUS;BIST BANKA GETIRI (ABD DOLARI);BIST BANKS RETURN (USD);USD;06/01/2023;2288.45
153;XBANK_CFNNTLER;BIST BANKA GETIRI (EURO);BIST BANKS RETURN (EURO);EUR;06/01/2023;2552.17
154;XSGRT_CFNNTLTL;BIST SIGORTA GETIRI;BIST INSURANCE RETURN;TRY;06/01/2023;27228.08
155;XSGRT_CFNNTLUS;BIST SIGORTA GETIRI (ABD DOLARI);BIST INSURANCE RETURN (USD);USD;06/01/2023;8450.38
156;XSGRT_CFNNTLER;BIST SIGORTA GETIRI (EURO);BIST INSURANCE RETURN (EURO);EUR;06/01/2023;9424.17
157;XFINK_CFNNTLTL;BIST FIN. KIR. FAKTORING GETIRI;BIST LEASING FACTORING RETURN;TRY;06/01/2023;3226.86
158;XFINK_CFNNTLUS;BIST FIN. KIR. FAKTORING GETIRI (ABD DOLARI);BIST LEASING FACTORING RETURN (USD);USD;06/01/2023;1001.47
159;XFINK_CFNNTLER;BIST FIN. KIR. FAKTORING GETIRI (EURO);BIST LEASING FACTORING RETURN (EURO);EUR;06/01/2023;1116.88
160;XHOLD_CFNNTLTL;BIST HOLDING VE YATIRIM GETIRI;BIST HOLD. AND INVESTMENT RETURN;TRY;06/01/2023;6760.07
161;XHOLD_CFNNTLUS;BIST HOLDING VE YATIRIM GETIRI (ABD DOLARI);BIST HOLD. AND INVESTMENT RETURN (USD);USD;06/01/2023;2098.02
162;XHOLD_CFNNTLER;BIST HOLDING VE YATIRIM GETIRI (EURO);BIST HOLD. AND INVESTMENT RETURN (EURO);EUR;06/01/2023;2339.79
163;XGMYO_CFNNTLTL;BIST GAYRIMENKUL Y.O. GETIRI;BIST REAL EST. INV. TRUSTS RETURN;TRY;06/01/2023;3955.62
164;XGMYO_CFNNTLUS;BIST GAYRIMENKUL Y.O. GETIRI (ABD DOLARI);BIST REAL EST. INV. TRUSTS RETURN (USD);USD;06/01/2023;1227.65
165;XGMYO_CFNNTLER;BIST GAYRIMENKUL Y.O. GETIRI (EURO);BIST REAL EST. INV. TRUSTS RETURN (EURO);EUR;06/01/2023;1369.12
166;XAKUR_CFNNTLTL;BIST ARACI KURUMLAR GETIRI;BIST BROKERAGE HOUSES RETURN;TRY;06/01/2023;22519.09
167;XAKUR_CFNNTLUS;BIST ARACI KURUMLAR GETIRI (ABD DOLARI);BIST BROKERAGE HOUSES RETURN (USD);USD;06/01/2023;6988.92
168;XAKUR_CFNNTLER;BIST ARACI KURUMLAR GETIRI (EURO);BIST BROKERAGE HOUSES RETURN (EURO);EUR;06/01/2023;7794.3
169;XYORT_CFNNTLTL;BIST MENKUL KIYM. Y.O. GETIRI;BIST INVESTMENT TRUSTS RETURN;TRY;06/01/2023;11995.9
170;XYORT_CFNNTLUS;BIST MENKUL KIYM. Y.O. GETIRI (ABD DOLARI);BIST INVESTMENT TRUSTS RETURN (USD);USD;06/01/2023;3722.99
171;XYORT_CFNNTLER;BIST MENKUL KIYM. Y.O. GETIRI (EURO);BIST INVESTMENT TRUSTS RETURN (EURO);EUR;06/01/2023;4152.02
172;XUTEK_CFNNTLTL;BIST TEKNOLOJI GETIRI;BIST TECHNOLOGY RETURN;TRY;06/01/2023;9229.43
173;XUTEK_CFNNTLUS;BIST TEKNOLOJI GETIRI (ABD DOLARI);BIST TECHNOLOGY RETURN (USD);USD;06/01/2023;2864.4
174;XUTEK_CFNNTLER;BIST TEKNOLOJI GETIRI (EURO);BIST TECHNOLOGY RETURN (EURO);EUR;06/01/2023;3194.49
175;XTKJS_CFCNTLTL;BIST TEKNOLOJI AGIRLIK SINIRLAMALI GETIRI;BIST TECHNOLOGY CAPPED RETURN;TRY;06/01/2023;13002.11
176;XTKJS_CFCNTLUS;BIST TEKNOLOJI AGIRLIK SINIRLAMALI GETIRI (ABD DOLARI);BIST TECHNOLOGY CAPPED RETURN (USD);USD;06/01/2023;4035.27
177;XTKJS_CFCNTLER;BIST TEKNOLOJI AGIRLIK SINIRLAMALI GETIRI (EURO);BIST TECHNOLOGY CAPPED RETURN (EURO);EUR;06/01/2023;4500.29
178;XBLSM_CFNNTLTL;BIST BILISIM GETIRI;BIST INF. TECHNOLOGY RETURN;TRY;06/01/2023;3568.66
179;XBLSM_CFNNTLUS;BIST BILISIM GETIRI (ABD DOLARI);BIST INF. TECHNOLOGY RETURN (USD);USD;06/01/2023;1107.55
180;XBLSM_CFNNTLER;BIST BILISIM GETIRI (EURO);BIST INF. TECHNOLOGY RETURN (EURO);EUR;06/01/2023;1235.18
181;XSADA_CFNNTLTL;BIST ADANA GETIRI;BIST ADANA RETURN;TRY;06/01/2023;139879.5
182;XSADA_CFNNTLUS;BIST ADANA GETIRI (ABD DOLARI);BIST ADANA RETURN (USD);USD;06/01/2023;43412.35
183;XSADA_CFNNTLER;BIST ADANA GETIRI (EURO);BIST ADANA RETURN (EURO);EUR;06/01/2023;48415.02
184;XSANK_CFNNTLTL;BIST ANKARA GETIRI;BIST ANKARA RETURN;TRY;06/01/2023;11247.24
185;XSANK_CFNNTLUS;BIST ANKARA GETIRI (ABD DOLARI);BIST ANKARA RETURN (USD);USD;06/01/2023;3490.64
186;XSANK_CFNNTLER;BIST ANKARA GETIRI (EURO);BIST ANKARA RETURN (EURO);EUR;06/01/2023;3892.89
187;XSANT_CFNNTLTL;BIST ANTALYA GETIRI;BIST ANTALYA RETURN;TRY;06/01/2023;8231.38
188;XSANT_CFNNTLUS;BIST ANTALYA GETIRI (ABD DOLARI);BIST ANTALYA RETURN (USD);USD;06/01/2023;2554.65
189;XSANT_CFNNTLER;BIST ANTALYA GETIRI (EURO);BIST ANTALYA RETURN (EURO);EUR;06/01/2023;2849.04
190;XSAYD_CFNNTLTL;BIST AYDIN GETIRI;BIST AYDIN RETURN;TRY;06/01/2023;3603.29
191;XSAYD_CFNNTLUS;BIST AYDIN GETIRI (ABD DOLARI);BIST AYDIN RETURN (USD);USD;06/01/2023;1118.3
192;XSAYD_CFNNTLER;BIST AYDIN GETIRI (EURO);BIST AYDIN RETURN (EURO);EUR;06/01/2023;1247.17
193;XSBAL_CFNNTLTL;BIST BALIKESIR GETIRI;BIST BALIKESIR RETURN;TRY;06/01/2023;7969.46
194;XSBAL_CFNNTLUS;BIST BALIKESIR GETIRI (ABD DOLARI);BIST BALIKESIR RETURN (USD);USD;06/01/2023;2473.37
195;XSBAL_CFNNTLER;BIST BALIKESIR GETIRI (EURO);BIST BALIKESIR RETURN (EURO);EUR;06/01/2023;2758.39
196;XSBUR_CFNNTLTL;BIST BURSA GETIRI;BIST BURSA RETURN;TRY;06/01/2023;19589.68
197;XSBUR_CFNNTLUS;BIST BURSA GETIRI (ABD DOLARI);BIST BURSA RETURN (USD);USD;06/01/2023;6079.76
198;XSBUR_CFNNTLER;BIST BURSA GETIRI (EURO);BIST BURSA RETURN (EURO);EUR;06/01/2023;6780.37
199;XSDNZ_CFNNTLTL;BIST DENIZLI GETIRI;BIST DENIZLI RETURN;TRY;06/01/2023;7066.92
200;XSDNZ_CFNNTLUS;BIST DENIZLI GETIRI (ABD DOLARI);BIST DENIZLI RETURN (USD);USD;06/01/2023;2193.26
201;XSDNZ_CFNNTLER;BIST DENIZLI GETIRI (EURO);BIST DENIZLI RETURN (EURO);EUR;06/01/2023;2446
202;XSIST_CFNNTLTL;BIST ISTANBUL GETIRI;BIST ISTANBUL RETURN;TRY;06/01/2023;8868.33
203;XSIST_CFNNTLUS;BIST ISTANBUL GETIRI (ABD DOLARI);BIST ISTANBUL RETURN (USD);USD;06/01/2023;2752.33
204;XSIST_CFNNTLER;BIST ISTANBUL GETIRI (EURO);BIST ISTANBUL RETURN (EURO);EUR;06/01/2023;3069.5
205;XSIZM_CFNNTLTL;BIST IZMIR GETIRI;BIST IZMIR RETURN;TRY;06/01/2023;16019.89
206;XSIZM_CFNNTLUS;BIST IZMIR GETIRI (ABD DOLARI);BIST IZMIR RETURN (USD);USD;06/01/2023;4971.86
207;XSIZM_CFNNTLER;BIST IZMIR GETIRI (EURO);BIST IZMIR RETURN (EURO);EUR;06/01/2023;5544.8
208;XSKAY_CFNNTLTL;BIST KAYSERI GETIRI;BIST KAYSERI RETURN;TRY;06/01/2023;31563.71
209;XSKAY_CFNNTLUS;BIST KAYSERI GETIRI (ABD DOLARI);BIST KAYSERI RETURN (USD);USD;06/01/2023;9795.96
210;XSKAY_CFNNTLER;BIST KAYSERI GETIRI (EURO);BIST KAYSERI RETURN (EURO);EUR;06/01/2023;10924.81
211;XSKOC_CFNNTLTL;BIST KOCAELI GETIRI;BIST KOCAELI RETURN;TRY;06/01/2023;32970.28
212;XSKOC_CFNNTLUS;BIST KOCAELI GETIRI (ABD DOLARI);BIST KOCAELI RETURN (USD);USD;06/01/2023;10232.5
213;XSKOC_CFNNTLER;BIST KOCAELI GETIRI (EURO);BIST KOCAELI RETURN (EURO);EUR;06/01/2023;11411.66
214;XSKON_CFNNTLTL;BIST KONYA GETIRI;BIST KONYA RETURN;TRY;06/01/2023;8297.45
215;XSKON_CFNNTLER;BIST KONYA GETIRI (EURO);BIST KONYA RETURN (EURO);EUR;06/01/2023;2871.91
216;XSKON_CFNNTLUS;BIST KONYA GETIRI (ABD DOLARI);BIST KONYA RETURN (USD);USD;06/01/2023;2575.16
217;XSMNS_CFNNTLTL;BIST MANISA GETIRI;BIST MANISA RETURN;TRY;06/01/2023;3834.87
218;XSMNS_CFNNTLUS;BIST MANISA GETIRI (ABD DOLARI);BIST MANISA RETURN (USD);USD;06/01/2023;1190.17
219;XSMNS_CFNNTLER;BIST MANISA GETIRI (EURO);BIST MANISA RETURN (EURO);EUR;06/01/2023;1327.32
220;XSTKR_CFNNTLTL;BIST TEKIRDAG GETIRI;BIST TEKIRDAG RETURN;TRY;06/01/2023;29720.16
221;XSTKR_CFNNTLUS;BIST TEKIRDAG GETIRI (ABD DOLARI);BIST TEKIRDAG RETURN (USD);USD;06/01/2023;9223.81
222;XSTKR_CFNNTLER;BIST TEKIRDAG GETIRI (EURO);BIST TEKIRDAG RETURN (EURO);EUR;06/01/2023;10286.73
